<?xml version="1.0" encoding="UTF-8"?>
<Persons xmlns:xsi="http://www.w3.org/2001/XMLSchema-instance"
         xmlns="http://bean.jd02_09.kisielev.it.by/"
         xsi:schemaLocation="http://bean.jd02_09.kisielev.it.by/ Persons.xsd"
>
    <Persons>
        <Persone>
            <Email>asdasd@gmail.com</Email>
            <Nickname>asdasd</Nickname>
            <Password>asdasd123123</Password>
            <Ads>
                <Ad Rooms="2">
                    <Descriptions> Квартира  в центре города</Descriptions>
                    <Adreses>пр.Независимости, д. 33 кв.25</Adreses>
                    <Floor>2</Floor>
                    <Floors>5</Floors>
                    <Square>60</Square>
                    <Price>66666</Price>
                </Ad>
                <Ad Rooms="1">
                    <Descriptions> Квартира  в центре города</Descriptions>
                    <Adreses>пр.Зеленого, д. 78 кв.6</Adreses>
                    <Floor>2</Floor>
                    <Floors>5</Floors>
                    <Square>25</Square>
                    <Price>66666</Price>
                </Ad>
            </Ads>
        </Persone>
        <Persone>
            <Email>qwertyuiop@gmail.com</Email>
            <Nickname>T1T1T1T</Nickname>
            <Password>QWERTYUIOP</Password>
            <Ads>
                <Ad Rooms="3">
                    <Descriptions> Квартира  на окраине</Descriptions>
                    <Adreses>у.Тебя, д.2 кв.229</Adreses>
                    <Floor>19</Floor>
                    <Floors>6</Floors>
                    <Square>70</Square>
                    <Price>100009</Price>
                </Ad>
            </Ads>
        </Persone>
    </Persons>